{
  "schemaVersion": "0.2",
  "status": "review-required",
  "phase": "strategy",
  "mode": "proposal",
  "provenanceNotice": "Hashes establish artifact identity and freshness only; they do not prove evidence quality, usability, or design merit.",
  "findings": [],
  "checks": [
    {
      "id": "provenance",
      "status": "pass",
      "required": true,
      "evidence": [
        "4 phase artifacts hashed."
      ]
    },
    {
      "id": "schemas",
      "status": "pass",
      "required": true,
      "evidence": []
    },
    {
      "id": "requirements",
      "status": "pass",
      "required": true,
      "evidence": []
    },
    {
      "id": "verification",
      "status": "not-applicable",
      "required": false,
      "evidence": [
        "This gate profile does not require rendered verification."
      ]
    }
  ],
  "artifacts": {
    "project": {
      "path": "project.json",
      "sha256": "19ea9572f155e7813da7a7240952bc3eea4be5ab5896e3c4fd770b7a8dc2975a"
    },
    "evidenceBrief": {
      "path": "01-evidence-brief.md",
      "sha256": "5fce54846c3bbdef0352f2be7831b3e37baab25814e455b18c0ed61507730077"
    },
    "experienceStrategy": {
      "path": "02-experience-strategy.md",
      "sha256": "4a1a44d491fd07c54c3baa33ca257bd4154f52d295a1b75949430978c5ef86e4"
    },
    "requirementsMap": {
      "path": "03-requirements-map.json",
      "sha256": "b07945321213f42a30653b3d574b842e8518fcc8a7071bc1174fdd8944ffb79f"
    }
  },
  "digests": {
    "design": "sha256:397636341c1a806202e5a1bbeea3f60cda42fff6711716543a07e2098fc944d7",
    "implementation": null,
    "verificationInput": null,
    "approval": "sha256:65711ff661ea85b4a70214838fb0015647d1ebf515b02a827ba06854561fb229"
  },
  "review": null,
  "run": {
    "version": "0.2.0",
    "runId": "gate-mrsit7sk-85900",
    "generatedAt": "2026-07-20T01:03:02.501Z"
  }
}
